{
  "status": "succeeded",
  "result": {
    "summary": "已阅读全文并核对资产表，完成林禾的人物理解与 identity 头像阶段文字首稿。",
    "design_decisions": [
      "将邵叔的“胆怯”评价与林禾送钥匙、留披肩的行动分开处理，不把评价画成固定面相。",
      "原创面部以平缓偏宽的颧侧和短钝颏为主，鼻口保持次要；明确了比例、眉眼与鼻唇结构。",
      "采用左侧偏分、贴耳发流和后颈低束发，兼顾头像识别与修理工作时的收束需求。",
      "区分稳定的自然肤质与 S01 雨夜的临时湿润状态；身体和衣装仅保留后续设计方向。"
    ],
    "unresolved": [
      "跨视角及与邵叔并排的识别效果，需在有图后核对。"
    ],
    "knowledge_used": [
      "knowledge/index.md",
      "references/director-understanding.md",
      "references/phased-design.md",
      "references/design-detail-standard.md",
      "references/knowledge/character-face-design/original-face.md",
      "references/knowledge/character-face-design/face.md",
      "references/knowledge/character-hair-design/hair.md",
      "references/knowledge/character-skin-design/skin.md",
      "references/knowledge/character-feature-focus/feature-focus.md",
      "references/knowledge/character-world-appearance-design/world-appearance.md",
      "references/knowledge/character-design/anti-stereotype-texture.md"
    ]
  },
  "artifacts": [
    "design.md"
  ],
  "questions": [],
  "error": null
}
