{
  "status": "succeeded",
  "result": {
    "summary": "已完成潮门修理铺黄昏单一时刻的第一步场景文字设计与完整中文静态提示词。",
    "design_decisions": [
      "保留狭长铺面与低工作台，用台腿、空置的钥匙放置面和连续窄通道说明工作、放置与通行关系。",
      "剧本 1-1 中钥匙由林禾握持，因此无人画面不预先摆放钥匙；夜场物件也不进入黄昏画面。",
      "以有限暖色工作光配合冷灰黄昏天光，材料色与受光色分开描述；普通陈设均为本轮美术提案。"
    ],
    "unresolved": [],
    "knowledge_used": [
      "skills/sence-prompts/SKILL.md",
      "skills/sence-prompts/references/asset-input.md",
      "skills/sence-prompts/references/worldbuilding-systems.md",
      "skills/sence-prompts/references/staging-layout.md",
      "skills/sence-prompts/references/art-direction.md",
      "skills/sence-prompts/references/prompt-delivery.md",
      "skills/sence-prompts/references/worldbuilding-design.md",
      "skills/sence-prompts/references/material-and-craft.md",
      "skills/sence-prompts/references/color-light-atmosphere.md",
      "skills/sence-prompts/references/palette-selection.md",
      "skills/sence-prompts/knowledge/color/entries/010.json"
    ]
  },
  "artifacts": [
    "design.md"
  ],
  "questions": [],
  "error": null
}
