{
  "status": "succeeded",
  "result": {
    "summary": "已完成铜闸钥匙 P1–P2 文字首稿，包含需求卡、三套结构差异明确的候选及推荐；方向仍待用户选择。",
    "design_decisions": [
      "A 为长椭圆环首，B 为实心楔形扁首，C 为横梁 T 首；推荐 A，未记为用户选择。",
      "三案均保留铜制与可用布擦干的外露齿槽；尺寸均标为建议、待确认。",
      "按剧本两场的握持与擦拭动作设计，未增加钥匙功能。"
    ],
    "unresolved": [
      "用户尚未选择 A/B/C；具体尺寸、齿形及锁具接口待确认。"
    ],
    "knowledge_used": [
      "skills/prop-concept-design/SKILL.md",
      "skills/prop-concept-design/references/workflow.md",
      "skills/prop-concept-design/references/output-contracts.md",
      "skills/prop-concept-design/references/era-and-culture-equipment.md"
    ]
  },
  "artifacts": [
    "design.md"
  ],
  "questions": [],
  "error": null
}
